{
  "$schema": "https://sourcegit-scm.github.io/sourcegit-theme.schema.json",
  "Version": "1.0",
  "Name": "Cyberpunk 2077",
  "Author": "@berkanuslu",
  "Url": "https://github.com/berkanuslu",
  "BasicColors": {
    "Window": "#131313",
    "WindowBorder": "#131313",
    "TitleBar": "#0d343b",
    "ToolBar": "#131313",
    "Popup": "#131313",
    "Contents": "#0d343b",
    "SubPanel": "#131313",
    "Badge": "#f9f500",
    "BadgeFG": "#D35400",
    "Conflict": "#1aee80",
    "Conflict.Foreground": "#a3d5d6",
    "Border0": "#920539",
    "Border1": "#f5405f",
    "Border2": "#8C6239",
    "FlatButton.Background": "#2C2C2C",
    "FlatButton.BackgroundHovered": "#8C6239",
    "FG1": "#f9f500",
    "FG2": "#f91643",
    "Diff.EmptyBG": "#cabf03",
    "Diff.AddedBG": "#3B4D61",
    "Diff.DeletedBG": "#920539",
    "Diff.AddedHighlight": "#0a7d4a",
    "Diff.DeletedHighlight": "#131313",
    "SystemAccentColor": "#32d8f2",
    "Link": "#00effe"
  },
  "GraphPenThickness": 2,
  "OpacityForNotMergedCommits": 0.5,
  "GraphColors": [
    "#f9f500",
    "#00effe",
    "#32d8f2",
    "#f91643",
    "#f5405f",
    "#D35400",
    "#8C6239",
    "#3B4D61",
    "#0a7d4a",
    "#cabf03",
    "#a3d5d6",
    "#920539",
    "#1aee80",
    "#131313",
    "#0d343b"
  ]
}