{
  "$schema": "https://sourcegit-scm.github.io/sourcegit-theme.schema.json",
  "Version": "1.0",
  "Name": "ForkDark",
  "Author": "@carun",
  "Url": "https://github.com/carun",
    "BasicColors": {
        "Window": "#1E1E1E",
        "WindowBorder": "#252526",
        "TitleBar": "#444444",
        "ToolBar": "#252526",
        "Popup": "#1E1E1E",
        "Contents": "#1E1E1E",
        "SubPanel": "#1E1E1E",
        "Badge": "#007ACC",
        "BadgeFG": "#FFFFFF",
        "Conflict": "#D16969",
        "Conflict.Foreground": "#FFFFFF",
        "Border0": "#3C3C3C",
        "Border1": "#444444",
        "Border2": "#444444",
        "FlatButton.Background": "#333333",
        "FlatButton.BackgroundHovered": "#3C3C3C",
        "FG1": "#D4D4D4",
        "FG2": "#D4D4D4",
        "Diff.EmptyBG": "#252526",
        "Diff.AddedBG": "#144212",
        "Diff.DeletedBG": "#660000",
        "Diff.AddedHighlight": "#22A822",
        "Diff.DeletedHighlight": "#CC0000",
        "SystemAccentColor": "#007ACC",
        "Link": "#3794FF"
    },
    "GraphPenThickness": 2,
    "OpacityForNotMergedCommits": 0.5,
    "GraphColors": [
        "#ff9502",
        "#ff2968",
        "#ffcc00",
        "#4EC9B0",
        "#cb73e1",
        "#1cadf8",
        "#CE9178",
        "#C8C8C8",
        "#808080",
        "#a2845e",
        "#99442b",
        "#22A822",
        "#CC0000"
    ]
}