{
  "$schema": "https://sourcegit-scm.github.io/sourcegit-theme.schema.json",
  "Version": "1.0",
  "Name": "JetBrainsDark",
  "Author": "@MelonHell",
  "Url": "https://gist.github.com/MelonHell",
  "BasicColors": {
    "Window": "#2b2d30",
    "WindowBorder": "#2b2d30",
    "TitleBar": "#2b2d30",
    "ToolBar": "#2b2d30",
    "Popup": "#2b2d30",
    "Contents": "#1e1f22",
    "SubPanel": "#2b2d30",
    "Badge": "#3574f0",
    "BadgeFG": "#ffffff",
    "Conflict": "#45302b",
    "Conflict.Foreground": "#ced0d6",
    "Border0": "#1e1f22",
    "Border1": "#4e5157",
    "Border2": "#4e5157",
    "FlatButton.Background": "#2b2d30",
    "FlatButton.BackgroundHovered": "#393b40",
    "FG1": "#ced0d6",
    "FG2": "#ced0d6",
    "Diff.EmptyBG": "#484a4a",
    "Diff.AddedBG": "#222e2a",
    "Diff.DeletedBG": "#2e2626",
    "Diff.AddedHighlight": "#294436",
    "Diff.DeletedHighlight": "#45302b"
  }
}