{
  "$schema": "https://sourcegit-scm.github.io/sourcegit-theme.schema.json",
  "Version": "1.0",
  "Name": "YInkie Theme Light",
  "Author": "@TrinkieYinkie",
  "Url": "https://github.com/TrinkieYinkie",
  "BasicColors": {
    "Window": "#eae2d8",
    "WindowBorder": "#a5988c",
    "TitleBar": "#f9f3eb",
    "ToolBar": "#efe4d9",
    "Popup": "#faf4ec",
    "PopupBorder": "#c0afa0",
    "Contents": "#f7f1e9",
    "SubPanel": "#e2d5c8",
    "Badge": "#a83f22",
    "BadgeFG": "#fff9f5",
    "Conflict": "#a95131",
    "Conflict.Foreground": "#fff9f5",
    "Conflict.MineBG": "#40c87652",
    "Conflict.TheirsBG": "#409d5a34",
    "Border0": "#cebdaf",
    "Border1": "#7f6d63",
    "Border2": "#dacbbe",
    "FlatButton.Background": "#eee0d3",
    "FlatButton.BackgroundHovered": "#ddcab9",
    "FlatButton.FloatingBorder": "#a79384",
    "FG1": "#2b2726",
    "FG2": "#665b54",
    "Diff.EmptyBG": "#e3d8cd",
    "Diff.AddedBG": "#e1dec2",
    "Diff.DeletedBG": "#ead2cd",
    "Diff.AddedHighlight": "#c0c485",
    "Diff.DeletedHighlight": "#dcb1aa",
    "Diff.BlockBorderHighlight": "#9f3c21",
    "SystemAccentColor": "#b34a2a",
    "Link": "#99371d",
    "InlineCode": "#e8d9cc",
    "InlineCodeFG": "#2b2726"
  },
  "GraphPenThickness": 2.25,
  "OpacityForNotMergedCommits": 0.78,
  "GraphColors": [
    "#a83d24",
    "#b75a1f",
    "#8c5c18",
    "#963b31",
    "#c24c27",
    "#a56f3a",
    "#78412f",
    "#8e5b44"
  ]
}
