{
  "$schema": "https://sourcegit-scm.github.io/sourcegit-theme.schema.json",
  "Version": "1.0",
  "Name": "SynthWave '84",
  "Author": "SynthWave '84",
  "Url": "https://marketplace.visualstudio.com/items?itemName=RobbOwen.synthwave-vscode",
    "BasicColors": {
        "Window": "#271530",
        "WindowBorder": "#271530",
        "TitleBar": "#271530",
        "ToolBar": "#271530",
        "Popup": "#4b276a",
        "Contents": "#291e36",
        "SubPanel": "#271530",
        "Badge": "#BF4040",
        "BadgeFG": "#1C1525",
        "Conflict": "#D16969",
        "Conflict.Foreground": "#FFFFFF",
        "Border0": "#312C39",
        "Border1": "#16151E",
        "Border2": "#312C39",
        "FlatButton.Background": "#49285E",
        "FlatButton.BackgroundHovered": "#582F71",
        "FG1": "#9d95a1",
        "FG2": "#b4abbc",
        "Diff.EmptyBG": "#291e36",
        "Diff.AddedBG": "#2A2C28",
        "Diff.DeletedBG": "#3C111E",
        "Diff.AddedHighlight": "#214836",
        "Diff.DeletedHighlight": "#570D22",
        "SystemAccentColor": "#680060",
        "Link": "#f97e72"
    },
    "GraphPenThickness": 2,
    "OpacityForNotMergedCommits": 0.5,
    "GraphColors": [
        "#ff9502",
        "#ff2968",
        "#ffcc00",
        "#4EC9B0",
        "#cb73e1",
        "#1cadf8",
        "#CE9178",
        "#C8C8C8",
        "#808080",
        "#a2845e",
        "#99442b",
        "#22A822",
        "#CC0000"
    ]
}
