{
  "$schema": "https://sourcegit-scm.github.io/sourcegit-theme.schema.json",
  "Version": "1.0",
  "Name": "YInkie Theme Dark",
  "Author": "@TrinkieYinkie",
  "Url": "https://github.com/TrinkieYinkie",
  "BasicColors": {
    "Window": "#191b21",
    "WindowBorder": "#41444c",
    "TitleBar": "#1b1e24",
    "ToolBar": "#262930",
    "Popup": "#2f323a",
    "PopupBorder": "#50545c",
    "Contents": "#1d2026",
    "SubPanel": "#262930",
    "Badge": "#ff6f4d",
    "BadgeFG": "#25130d",
    "Conflict": "#d96a3e",
    "Conflict.Foreground": "#25130d",
    "Conflict.MineBG": "#405b463c",
    "Conflict.TheirsBG": "#40704a30",
    "Border0": "#34373f",
    "Border1": "#70737b",
    "Border2": "#41454e",
    "FlatButton.Background": "#2a2d34",
    "FlatButton.BackgroundHovered": "#353941",
    "FlatButton.FloatingBorder": "#5f636b",
    "FG1": "#f4f1eb",
    "FG2": "#c0bbb3",
    "Diff.EmptyBG": "#15171c",
    "Diff.AddedBG": "#303824",
    "Diff.DeletedBG": "#462c2a",
    "Diff.AddedHighlight": "#45512d",
    "Diff.DeletedHighlight": "#653834",
    "Diff.BlockBorderHighlight": "#ff8a64",
    "SystemAccentColor": "#ff6f4d",
    "Link": "#ff9a76",
    "InlineCode": "#292522",
    "InlineCodeFG": "#f4f1eb"
  },
  "GraphPenThickness": 2.25,
  "OpacityForNotMergedCommits": 0.78,
  "GraphColors": [
    "#ff6f4d",
    "#f28a38",
    "#e3b044",
    "#d37a63",
    "#e64c2f",
    "#d59b5e",
    "#c35c39",
    "#f0a985"
  ]
}
